text,topic
u spy satellite built spacex send signal wrong direction,Technology
flu season look grim hn emerges mutation,Technology
google claim win everyone text scammer lost cloud server,Technology
sander rue rough debut gabriel concussed,Sports
source concern rodgers break left wrist,Sports
eagle make statement shuts goff lion,Sports
mahomes take blame division title hope fade,Sports
draymond confronts fan angel reese chant,Sports
exqb kosar say receive liver transplant,Sports
source naylor mariner reunite year deal,Sports
allen tds draw unreal praise bill,Sports
game blouse bear jab vikes top troll,Sports
eagle roll lion here know week including main takeaway,Sports
connellys favorite game went mean,Sports
sec offered dose playoff football week,Sports
week winner loser allen mccaffrey dominate chase jefferson go quiet,Sports
buzz tucker go buccaneer packer lose jacob ridley season,Sports
projecting tuesday cfp top sooner tide land,Sports
orlando nwsl title defense whats next marta,Sports
mlb offseason grade mariner resign naylor winter first big move,Sports
skaggs court case angel challenge mount,Sports
arsenal bayern marseille lesson learned across europe top league game,Sports
world cup ukraine keep world cup hope alive clinched playoff spot,Sports
reyna take advantage opportunity return usmnt continues unbeaten run,Sports
usmnt player rating reyna impress return,Sports
nfl week fashionable arrival featuring eagle wr devonta smith,Sports
intel could elee flip texas miami making move,Sports
grant breeze second lpga title annika,Sports
whats next makhachev shevchenko star ufc,Sports
draft riser question note wr class stack,Sports
team make playoff simulate rest regular season,Sports
transfer rumor news barcelona bayern man united fight vlahovic,Sports
nfl week overreaction charger verge secondhalf collapse bench jj mccarthy,Sports
nfl week grade josh allen will bill bronco earn b upset win chief,Sports
nfl draft order week dolphin playing qb hunt ram top pick via trade,Sports
bear nahshon wright pay tribute late coach john beam interception one,Sports
ram terrorize sam darnold take control nfc west race seahawks defense lead way,Sports
josh jacob injury update packer running back knee issue expected seasonending,Sports
nwsl championship njny gotham fc washington spirit meet title game,Sports
michael penix jr injury falcon qb evaluated hurting knee leaving game loss panther,Sports
josh naylor resigning mariner fiveyear contract offseasons first major freeagency signing,Sports
steelers jalen ramsey ejected throwing punch jamarr chase accuses bengal wr spitting,Sports
aaron rodgers injury update steelers qb wrist evaluated mason rudolph lead pittsburgh victory,Sports
anthony davis injury update maverick star least additional day calf strain,Sports
nfl week winner loser josh allen play superman bill bengal falcon flop yet,Sports
one knoxville sc top spokane velocity claim first usl league one title club history,Sports
sunday night football prediction odds line start time lion v eagle pick expert roll,Sports
nfl dfs eagle v lion top fanduel draftkings daily fantasy football pick sunday night football,Sports
fantasy football week breakout sean tucker power way monster performance,Sports
lion v eagle nfl player prop sgp selflearning ai back jahmyr gibbs carry snf,Sports
watch eagle v lion tv channel live stream preview snf,Sports
eagle v lion prediction odds line time nfl week sunday night football pick advanced model,Sports
travis kelce set chief record career touchdown scored star tight end pass priest holmes top spot,Sports
shedeur sander make nfl debut former colorado star qb enters dillon gabriel exit concussion,Sports
jaedyn shaw score dramatic lastminute free kick send gotham fc back nwsl championship,Sports
led marta suarez olivia mile tcu announces contender status win nc state,Sports
tomorrow top today purdue poised leap houston return college basketball ranking,Sports
joe burrow injury update bengal qb possible return game there definitive return date,Sports
fifa world cup qualified team portugal clinch spot tournament nigeria miss,Sports
bill wild win buccaneer end final score thats never happened nfl history,Sports
tennessee expected part way db boo carter ongoing issue lead departure vols program,Sports
explaining uclas penn state problem targeting james madison bob chesney coaching carousel,Sports
look ram wearing new midnight mode rivalry uniform week showdown v seahawks,Sports
adam schenk claim first pga tour win amid windy condition bermuda championship,Sports
rory mcilroy win seventh race dubai title matt fitzpatrick claim dp world tour championship,Sports
raven v brown watch nfl week score prediction betting odds sportsbook promos sgp pick,Sports
ram v seahawks watch nfl week betting odds score prediction sportsbook promos sgp pick,Sports
use bet bonus code cbsbet get bonus bet targeting nfl week broncoschiefs brownsravens,Sports
rossi may follow nancy celtic gossip,Sports
spur fringe dutch delight parrotts rise irish hero,Sports
boland say root england player keep quiet,Sports
world cup flix tshisekedi welcome leopard today,Sports
world cup haaland reacts norway qualification,Sports
report barcelona away kit set bring sense nostalgia,Sports
liverpool enter talk sign african superstar,Sports
premier league icon slam critic unfair treatment real madrid talisman hate cant reach,Sports
monday fixture germany netherlands croatia qualifier,Sports
today headline portugal norway hit big win bernabu,Sports
luxembourg dead rubber still matter ni,Sports
nagelsmann confirms talk adeyemi reported illegal weapon possession case,Sports
netherlands v lithuania match preview team news,Sports
still huge thomas frank talk become chelsea manager,Sports
world cup timothy fayulu hero dr congo nigeria,Sports
casemiro man united midfielder make clear loyalty lie,Sports
hoddle coffee tottenham hotspur news link monday november,Sports
bill simmons highlight shai gilgeousalexanders appreciated skill quotyou dont think footwork think himquot,Sports
qualify world cup week,Sports
arsenal injury woe mount ahead bayern clash,Sports
barcelona keeping tab former la masia prodigy amid concern leftback position,Sports
troostekong nigeria elimination difficult day,Sports
nt bos insists real madrid star accept decision amid substitution drama accept respect,Sports
rom battle west ham joshua zirkzee,Sports
kendrick perkins say perfect solution solve nbas allstar woe quotmoney wood make game go goodquot,Sports
world cup draw date start time format qualified,Sports
world cup qualifying playoff draw,Sports
report first baseman josh naylor finalizing year contract mariner,Sports
respect teammate england bos tell jude bellingham unhappy reaction albania,Sports
longhorn daily news texas alum kris boyd stable condition suffering gunshot wound,Sports
duke bounce back wvu loss beating liberty,Sports
oscar discharged hospital heart issue,Sports
atwitter nov commander special team offense come small winning time moment madrid,Sports
lion player furious controversial penalty end loss eagle bleep,Sports
eagle overcome another sluggish offensive performance bat boy snuff lion,Sports
manchester city star man continues strong form help lead norway world cup,Sports
maxey er take harden clipper,Sports
dallas visit minnesota overtime win portland,Sports
golden state face orlando look th straight road win,Sports
memphis face san antonio look end game skid,Sports
free agent tomiyasu still play world cup say japan coach,Sports
northern ireland v luxembourg tv tonight channel kickoff time watch world cup qualifier free,Sports
rom eyeing fabbian frendrup strengthen midfield,Sports
hard channel island player become professional,Sports
haway podcast week brady debut false hope christmas light,Sports
watch canadiens v blue jacket today channel time schedule live stream monday night hockey,Sports
concern creeping barcelona surrounding form defensive duo,Sports
idea part way romano say man utd explore sale app red three year deal,Sports
official another real madrid star leaf national team muscle discomfort,Sports
adam wharton man united target receives public criticism england performance,Sports
last week tonight john oliver pay tribute late jimmy kimmel live bandleader cleto escobedo iii,Entertainment
see dont debut atop korea box office,Entertainment
john oliver launch last week tonight auction including original bob ross painting support public broadcasting,Entertainment
demon slayer infinity castle open china,Entertainment
tom cruise accepts honorary oscar emotional speech governor award making film,Entertainment
walmart serf walton goggins grinch warm black friday,Entertainment
ai drama human loop receives film independent sloan distribution grant enters oscar race exclusive,Entertainment
chess review lea michele reign queen uneven broadway revival,Entertainment
anushka sen launch music career debut single chameleon produced twotime grammy winner ken lewis exclusive,Entertainment
farhan akhtars bahadur make history india defense theater release exclusive,Entertainment
governor award tom cruise finally get oscar current award hopeful turn drove,Entertainment
story director abu bakr shawky say film inspired egyptian dad austrian mother started pen pal world meeting,Entertainment
last samurai standing star junichi okada making netflix series thats mixture squid game shogun,Entertainment
chess theater review lea michele aaron tveit nicholas christopher headline conflicted broadway revival cold war concept musical,Entertainment
governor award arrival ariana grande jennifer lopez star black carpet,Entertainment
demon slayer infinity castle open china lifting cume worldwide,Entertainment
jennifer lawrence say scary waiting audience reaction movie,Entertainment
bravocon biggest moment day,Entertainment
f la vega grand prix complete guide ticket party event viewing experience updating,Entertainment
original naked gun director criticizes liam neesonled reboot everybodys money,Entertainment
sister wife meri brown alleges ex kody brown asked sign nda,Entertainment
summer house star kyle cooke address amanda batula divorce rumor,Entertainment
kim kardashian share bts look bar prep failing legal exam,Entertainment
new york jet player kris boyd hospitalized midtown shooting,Entertainment
glen powell brings ups driver snl year canceled host stint,Entertainment
southern charm madison lecroy involved car crash bravocon,Entertainment
mustsee walmart black friday furniture deal cant miss,Entertainment
secret home alone leave thirsty,Entertainment
quince bag look like bottega yep found,Entertainment
inside serena williams love story alexis ohanian,Entertainment
inside pete davidson pregnant elsie hewitts whirlwind love story,Entertainment
wicked secret dancing life,Entertainment
real story behind teresa giudice joe gorgas reconciliation,Entertainment
jan ravnik return dancing star say,Entertainment
mercedes javid reveals tommy feight stand amid divorce,Entertainment
grey anatomy star james pickens jr share prostate cancer diagnosis,Entertainment
camille grammer epically thanks ex kelsey grammer frasier money,Entertainment
sophie grgoire trudeau reacts justin trudeau katy perry romance,Entertainment
adidas early black friday get samba regularly,Entertainment
rhoslcs lisa barlow slam costars desperate lie,Entertainment
rhonjs melissa gorga share shocking update teresa giudice feud,Entertainment
cardi b hint name new baby stefon diggs,Entertainment
vprs tom sandoval make rare comment ex ariana madix,Entertainment
southern charm austen kroll confirms audrey pratt breakup,Entertainment
diamond gift guide musthave jewelry classic every price point,Entertainment
britney spear hang kim kardashian khloe kardashian,Entertainment
walmart early access beauty deal live,Entertainment
meghan trainors confession boob job weight loss,Entertainment
inside eddie murphy family treewhich includes martin lawrence,Entertainment
kris jenner share personal goal birthday milestone,Entertainment
see dont trick sleeve,Entertainment
running man colman domingo host,Entertainment
nouvelle vague reference explained,Entertainment
today top director issue gen z,Entertainment
sag award change name actor award,Entertainment
death poet andrea gibson get film celebrates life,Entertainment
eddie murphy address snl feud eddie documentary,Entertainment
new movie critic talking week,Entertainment
homayoun ershadi dy kite runner taste cherry star,Entertainment
leslie odom jr back room happens,Entertainment
elizabeth franz versatile tonywinning actress dead,Entertainment
five international movie stream,Entertainment
come see good light sweetness terminal diagnosis,Entertainment
jonas christmas movie review come ye faithful,Entertainment
sofia coppola honored moma benefit elle fanning bill murray david letterman,Entertainment
running man review glen powell play life,Entertainment
nouvelle vague review richard linklaters ode breathless,Entertainment
viridiana luis buuels revenge,Entertainment
thing kill review tragedy turn surreal,Entertainment
rebuilding review life buck,Entertainment
see dont review magic gathering,Entertainment
keeper review get cant get,Entertainment
king ivory review oklahoma turn gangland,Entertainment
carpenter son review first temptation christ,Entertainment
bunny review right thing,Entertainment
eddie review eddie murphy look back,Entertainment
arco review technicolor apocalypse,Entertainment
sally kirkland scenestealing actress dy,Entertainment
hollywood bowl name stage john williams,Entertainment
pope leo share favorite movie ahead vatican event,Entertainment
brawling drama take fight oscar,Entertainment
tatsuya nakadai japanese star known ran classic dy,Entertainment
aidan zamiri directing timothe chalamet charli xcx today hottest star,Entertainment
rsv hospitalization rate senior time higher usual point season,Health
covid booster could keep thousand kid hospital uptake remains low,Health
experimental therapy gantenerumab fails slow improve alzheimers memory loss clinical trial,Health
u get grade rising preterm birth rate new report find,Health
desperate heart surgery baby family feel effect pediatric hospital shortage,Health
fuzzy first photo black hole get sharp makeover,Health
paper airplane break world distance record,Health
bat fossil could fill piece evolutionary puzzle,Health
long use vintage tupperware,Health
nightmare stop,Health
guide finding right theragun massage gun,Health
activewear brand add workout wardrobe,Health
best coupon cv pharmacy,Health
planet getting hotter fast happens body extreme heat,Health
medication abortion like according doctor,Health
cool without ac,Health
benefit body doubling adhd according expert,Health
think cant focus long youre right,Health
know there sexual attraction partner according therapist,Health
wheelchair hearing aid yes disabled way,Health
infant formula company tied botulism outbreak known problem,Health
bird flu ravaged world largest elephant seal population study find,Health
scientist grow hopeful ending global organ shortage,Health
fda name agency veteran run drug division,Health
young woman grappling old man disease,Health
overlooked sabina spielrein visionary lost freud jung,Health
arline bronzaft campaigned quieter city dy,Health
unemployment take toll mental health,Health
antidepressant teen sexual development,Health
infant formula recall expands botulism outbreak grows,Health
nolan williams stimulated brain treat depression dy,Health
parent child autism easy answer,Health
fda remove black box warning hormone treatment menopause,Health
nasa european partner set launch sentinelb earth satellite,Science
thing know nasa new u european sea satellite,Science
nasa set launch coverage international ocean tracking mission,Science
mapping dark matter,Science
nasa glenn team win rd award,Science
hubble study star age colorful galaxy,Science
nasa blue origin launch two spacecraft study mar solar wind,Science
curiosity blog sol spooky earth today,Science
curiosity blog sol searching answer monte grande,Science
curiosity blog sol drill boxwork unit go,Science
watch leonids meteor shower reach peak,Science
blue origin land booster rocket launch match spacexs feat,Science
dog bc amazingly diverse,Science
lost sister pleiades fill entire night sky,Science
many people die india hot weather nobody really know,Science
trump administration revoke biden ban drilling mining alaska wilderness,Science
greenhouse gas emission head record global carbon project report,Science
see northern light wednesday,Science
visiting leiden canal charm without crowd amsterdam,Science
northern light bring dazzling view northeast u across canada possible tonight,Science
there new forecast peak oil demand increasingly cloudy,Science
newsom spotlight climate conference trump decided skip,Science
trump said propose opening california coast oil drilling,Science
sea creature fossil show color rainbow,Science
cop belm brazil chinese technology shifting climate politics,Science
everyone want meet world boring man,Science
scientist create trillion degree particle soup mimic universe big bang,Science
life expectancy type diabetes varies dramatically nation,Science
amelia earhart record released u spy agency,Science
scientist unearth mysterious meteorite crater china,Science
man tickborne meat allergy dy eating burger,Science
sun continues celestial firework display powerful solar flare,Science
new glenn rocket launch test jared isaacmans commercial space vision nasa,Science
woolly mammoth unlocks reveals world oldest rna,Science
stranded chinese astronaut return earth space junk threat remain,Science
raccoon showing early sign domestication,Science
global study reveals best city walking cycling,Science
name galaxy knew existed,Science
new kind vaccine offer hope surviving pancreatic cancer,Science
blue origin nasa launch mar shot across bow elon musk spacex,Science
turkey risk bird flu thanksgiving,Science
dog skull analysis rewrite evolution humanity best friend,Science
jeffrey epstein email reveal tie prominent scientist,Science
godfather ai break major science research record,Science
cause cancer maud slye thought answer way stop,Science
chinese expedition reveals unexplored section mysterious arctic ocean ridge,Science
scientist might soon predict ocean rogue wave,Science
cia kryptos puzzle creator release final clue,Science
heat wave less extreme paris climate agreement,Science
epsteinbarr virus may cause lupus,Science
iea predicts oil gas demand rise beyond departing previous forecast,Science
northern light dazzle u sky powerful solar storm,Science
identify prime number without computer,Science
talking ai version loved one help grieve,Science
powerful solar storm could trigger farreaching aurora across u,Science
learning another language may slow brain aging huge new study find,Science
china stranded astronaut safefor get home,Science
world largest wind turbine smash previous record,Science
canada lost measlesfree status u could soon follow,Science
fda strip breast cancer warning menopause hormone therapy,Science
space place earth next evolutionary leap,Science
everyone schizophrenia hears voice here,Science
mathematician chalkboard writing show inspiration strike,Science
exploring food texture taste perception kendra pierrelouis,Science
ai slophow every medium revolution breed rubbish art,Science
rubin observatory discovers surprise tail iconic galaxy,Science
james watson codiscoverer dna structure dead age,Science
early arctic cold snap could break decadesold temperature record,Science
china stranded astronaut show danger space junk,Science
faa flight reduction plan mean safety cancellation,Science
world largest spider web discovered bizarre sulfur cave,Science
milky way warped,Science
tom zeller jr migraine research gender bias cultural stigma headache,Science
study suggests covid pandemic may aged everyones brain,Science
two vaquita calf offer flicker hope endangered porpoise earth,Science
ai decodes visual brain activityand writes caption,Science
british church putting faith heat pump,Science
physic northern light,Science
u build data center here go,Science
first radio signal comet iatlas end debate nature,Science
mysterious math behind brazilian butt lift,Science
hidden math ocean wave,Science
geneediting therapy cut cholesterol level half,Science
trump hatred ev making gas car expensive,Science
unpicking measure complexity knot,Science
follow trajectory comet iatlas,Science
blood test alzheimers,Science
new type opioid killing people u europe australia,Science
new lightbased cancer treatment kill tumor cell spare healthy one,Science
watch leonids meteor shower,Science
physicist create thermometer measuring quantumness,Science
onair claim dominion voting system false fox news acknowledges statement deal announced,General
dominion still pending lawsuit election denier rudy giuliani sidney powell,General
specific fox broadcast tweet dominion say defamatory,General
judge fox newsdominion defamation trial party resolved case,General
difficult say straight face tapper reacts fox news statement settlement,General
million u could face massive consequence unless mccarthy navigate debt trap set biden,General
white homeowner accused shooting black teen rang doorbell turn face criminal charge,General
newly released video show scene jeremy renners snowplow accident,General
jake gyllenhaal jamie lee curtis spent covid lockdown together,General
toddler crawl white house fence prompt secret service response,General
jamie foxx remains hospitalized nearly week medical complication,General
yearold dy participating benadryl tiktok challenge,General
see pizza delivery guy take suspect fleeing police,General
netflix winding dvd business year,General
ftc chair lina khan warns ai could turbocharge fraud scam,General
eating much food driving rise type diabetes study say,General
adhd medication abuse school wakeup call,General
apple ceo presented original macintosh see reaction,General
democrat bash justice clarence thomas plan investigate ethic allegation unclear,General
russia going backwards equipment deploying post wwiiera tank according western official,General
two russian claiming former wagner commander admit killing child civilian ukraine,General
stomach hurting laughing hear panelist reaction desantis threat disney,General
gop prepared block vote replace feinstein senate judiciary,General
oklahoma governor call official resign recording racist threatening remark,General
mccarthy slam biden handling u debt,General
u warns russia touch american nuclear technology ukrainian nuclear plant,General
repeated gunshot fired live tv exlawmaker shot assassin,General
fda clear way additional bivalent booster certain vulnerable individual,General
maine authority detained person interest people found dead home others shot driving,General
southwest say flight resumed delay caused tech issue,General
damar hamlin cleared resume football activity january cardiac arrest,General
pilot make history landing top story hotel,General
top u navy admiral defends nonbinary sailor amid republican criticism,General
fulton county da say fake trump elector incriminating one another want lawyer disqualified,General
high speed train racing across world america,General
podcast one country musician calling artist oppose assault rifle,General
here need know havent filed return yet even,General
undocumented immigrant paying tax today,General
opinion millionaire like u want pay tax,General
world longest purposebuilt cycling tunnel open norway,General
artist reject photo prize aigenerated image win award,General
ship disappeared lake superior century ago watch theyre found,General
erotic image senior show sex intimacy new light,General
china economy solid start rising q,General
even wife make much husband still home,General
mcdonalds upgrading burger,General
googleparent stock drop fear could lose search market share aipowered rival,General
bidet save money reduce waste tested best option,General
product make life easier planet cleaner,General
mother day around corner thoughtful gift shell love,General
headtotoe guide men dress spring shop,General
useful travel product buy amazon,General
best highyield saving account april,General
tax due tomorrow here file extension,General
composting easy way reduce food waste here,General
stopped using aluminum foil cooking here use instead,General
beloved dyson supersonic hair dryer lowest price ever,General
everything need know way day wayfairs biggest sale year,General
best amazon deal shop week,General
mifepristone saved life,General
presidential alternative many voter want,General
isnt house judiciary committee looking thomas,General
top secret come spilling,General
sudan go casting despotic rule,General
michelle yeoh set return new star trek movie,General
recap succession find dark humor aftershock,General
yellowjackets lean hard music nostalgia,General
jeremy renner revisits amazing group people helped recover accident,General
review barry take whack farewell season,General
u border patrol arrested people charlotte nc,General
new international student enrollment plummeted fall survey find,General
catholic church trump immigration crackdown take center stage,General
friend say suspect louvre heist tried leave rough past behind,General
pill womens libido meet cultural moment,General
brutal mississippi jail inmate say enlisted enforcer,General
new orleans elect exonerated man calvin duncan criminal court clerk,General
shared symbol jihad taliban defy old tie pakistan,General
