text,topic
ken burn win american revolution,General
carter anderson jean gigantic internet fame,General
saudi leader looking inward come washington,General
christian answer trump trumpism finally,General
woman describe horror endured assads prison,General
new york jet player kris boyd critically wounded shooting,General
trumpstyle candidate head runoff chile election,General
trump give leg south korea dream nuclearpowered sub,General
nfl broadcaster cris collinsworth rip late penalty lion eagle defense dominates win,General
meghan markles beige christmas collection spark intense backlash past royal color claim,General
nfl week score josh allen dominance lift bill win multiple game finish tight,General
kylie jenner post nude photo instagram week attending sister birthday trip,General
golden toilet scandal zelenskyy face deepest crisis yet ally accused wartime scheme,General
bronco take commanding lead afc west win chief playoff hope receive huge hit,General
charlie kirk honored jerusalem hundred gather including official clergy christian,General
socialist wave reach west coast los angeles mayor karen bass get mamdanilike challenger,General
exgiants star brandon jacob sends blunt warning jaxson dart concussion learn slide,General
raven star fool brown defense fake tush push goahead td run,General
justin trudeaus ex admits katy perry romance affect emotionally candid interview,General
nfl official collides bronco sean payton head coach receives penalty,General
pawn star rick harrison back trump america deadly fentanyl epidemic fighting terrorist dealer,General
josh allen six touchdown push bill past buccaneer thriller,General
dolphin star pitch jerusalem possible nfl international game,General
eddie murphy claim yul brynner made sexual proposition st birthday party studio,General
hunter biden urge democrat turn temperature pressed extremism,General
chief travis kelce word bronco defender pivotal divisional matchup,General
nfl star quarterback banged week player already feeling pain,General
unexpected city top list stressfree getaway year according new data,General
