text,topic
inside ford new world headquarters scratch kitchen rotisserie chicken design secret,Business
government shutdown air traffic controller shortage,Business
trump cut tariff good like coffee banana beef bid slash consumer price,Business
walmart share outgoing ceo doug mcmillons tenure here compare rival,Business
jpmorgan chase win fight fintech firm fee access customer data,Business
walmart ceo doug mcmillon retire january nearly year leading retailer,Business
fewer burrito bargain consumer flash holiday warning sign,Business
billionaire family opt buying sport team collecting art car,Business
dr horton tapping startup ai zoning tool build home,Business
surveillance tech lead worker comp claim plummet nyc construction site,Business
new foreclosure jump october sign distress housing market,Business
boeing defense worker approve new contract ending month strike,Business
disney stock fall medium giant post mixed result,Business
ml game head apple tv season pas subscription end,Business
congressional hemp restriction threaten billion industry sending company scrambling,Business
starbucks worker union launch strike city chain key holiday sale day,Business
sothebys ceo see strong demand ahead billion art auction,Business
verizon chairman mark bertolini say board needed act revive company,Business
startup backed bezos benioff launched trading platform share rental home,Business
ai esg family office expect heir take new path investing,Business
skim valued billion new funding round accelerates store expansion,Business
dot freeze flight cut disruption ease shutdown end,Business
toyota open new u battery plant confirms billion new investment,Business
wnbas la vega ace coach becky hammon say league may need new leadership,Business
share swiss sneaker company soar raise guidance,Business
airline warn flight cancellation continue even shutdown end,Business
real estate titan barry sternlicht say drop employee favor ai,Business
flight disruption shutdown pile trump threatens air traffic controller,Business
disney newest cruise ship destiny getting ready set sail here peek inside,Business
lawmaker push starbucks resume union negotiation,Business
get kidnapped bitcoin,Business
crypto industry billion dirty money,Business
trump tariff push japan economy contraction,Business
matthew belloni yelling iceberg hollywood titanic,Business
pasta twice price italian producer face huge u tariff,Business
got low mortgage rate pandemic cant move,Business
former fed official violated trading rule disclosure show,Business
economist asked much spend avoid ai apocalypse,Business
whats elegant way lie coworkers,Business
college football team short cash sport betting help,Business
hochul urged ban horseshoe crab fishing,Business
lil luv dog launch gooplike beauty brand dog,Business
disney youtube tv end blackout,Business
trump administration lift food tariff effort ease price,Business
fda sharply limit use drug linked two teen death,Business
judge approve purdue pharma bankruptcy releasing billion opioid plaintiff,Business
trump administration scrap cash payment delayed canceled flight,Business
reopened government hasnt ended delay economic data,Business
redbird capital withdraws takeover bid uk telegraph,Business
jpmorgan pay charlie javices legal fee restaurant bill,Business
whats digital passport work,Business
trump turn affordability message amid economic frustration,Business
switzerland reach agreement u cut tariff,Business
stock market rally dented sign worry emerge,Business
deal higher home heating bill,Business
indigenous people take stage cop climate talk belm brazil,Business
palantir market valuable military contractor doesnt make bomb gun,Business
walmart ceo doug mcmillon retire john furner named successor,Business
apple iphone pocket issey miyake confusing design,Business
anthropic say ai agent aided chinese hacking,Business
conservative medium pick epstein story line stick,Business
rfk jr walk tightrope trump deal obesity drug,Business
hollywood starstudded movie failing box office,Business
housing official attacked democrat invokes disputed family legacy,Business
anthropic say chinese hacker used ai online attack,Business
sharon camp mother plan b contraceptive pill dy,Business
escape india air pollution afford,Business
closure transparency harassment victim seek resolution,Business
trump official prepare tariff exemption seeking lower food price,Business
jim avila former abc news correspondent dy,Business
boeing defense worker approve new contract,Business
netflix bringing video game user tv,Business
global climate leadership vacuum,Business
starbucks worker striking dozen store red cup day,Business
war top investor adviser growing,Business
south korean worker return georgia factory u reissue visa,Business
luxury electric vehicle trouble,Business
blackrockbacked roofing conglomerate go bust,Business
man accused running southeast asia scam compound extradited china,Business
trump administration proposes drastic cut housing grant,Business
tiktok came rival ebay global online shopping destination,Business
here whats going trump tariff price supreme court,Business
former fed governor violated central bank trading rule new disclosure show,Business
shutdown nation aviation problem,Business
estate planning kid get equal share,Business
dont call msnbc m take trump washington,Business
trump go defense tariff price everyday item keep rising,Business
wall street bank prepare sell billion dollar x loan,Business
canada provide million canada post avoid insolvency mail service,Business
amazon willing discus quebec shutdown canadian official,Business
target drop dei goal end program boost black supplier,Business
energy utility roundup market talk,Business
basic material roundup market talk,Business
auto transport roundup market talk,Business
financial service roundup market talk,Business
novo nordisk share surge new obesity drug result,Business
eu conditionally approves international paper billion d smith buy,Business
google put warning uk business using fake online review,Business
ericsson share slump earnings hit weakness outside core network business,Business
verizon result boosted higher price gain wireless customer,Business
need escape wildfire ev know,Business
caixabanks cfo see case dealmaking among europe bank,Business
tesla recall car china safety concern,Business
korea zinc share rally adopting new investor protection rule,Business
burberry see positive sign turnaround plan continues,Business
rollsroyce strike contract supply nuclear reactor uk submarine,Business
china weride want build global robotaxi empire,Business
visa lean aienabled payment stablecoins stay ahead game asia,Business
bessent say trump check would need congressional vote,Business
coast guard seized record amount cocaine trump say interdiction failed blowing suspected drug boat,Business
grocery may benefit tariff exemption midterm election get closer analyst say,Business
class american rhodes scholar includes student u military academy,Business
advanced u aircraft carrier arrives caribbean trump add growing fleet warship near venezuela,Business
voter demand affordability stanford economist argues temporary targeted price control supplyside reform,Business
dr oz say discussion extending affordable care act subsidy republican scramble address soaring healthcare cost,Business
ford first new headquarters year showroom like james bond villain lair design chief say,Business
sound whistle chicago neighborhood lead way ice resistance,Business
indiana republican called trump redistricting swatted,Politics
trump break wacky marjorie taylor greene,Politics
indiana redistricting push likely dead despite white house pressure,Politics
win back disillusioned voter playbook podcast,Politics
nevada dems gop battle notaxontips,Politics
seth moulton epstein email venezuela shutdown,Politics
nation cartoonist week politics,Politics
nevada senator spurned party reading room,Politics
seth moulton senate bid venezuela epstein file conversation,Politics
shocking revelation epstein doc,Politics
rahm emanuel considering white house bid urge dems move center crime,Politics
protester un security clash climate summit brazil,Politics
maine democrat drop senate bid battleground house run,Politics
trump built surprising voter coalition one key piece cracked,Politics
utah judge denies goppassed congressional map,Politics
top maryland dems urge state lawmaker join redistricting effort,Politics
complete betrayal democrat slam shutdown deal,Politics
poll here much trump voter would pay tax back policy,Politics
ted cruz accuses gop senator frightened call tucker carlson,Politics
nation cartoonist week politics,Politics
pod save america podcasters host cpac left,Politics
poll here democrat think leader,Politics
free mofongo mamdani dazzle democratic insider san juan,Politics
spanberger make inroad rural republican unhappy trump,Politics
socialist mayor wall street coexist new york find,Politics
sherrill dismisses democratic bedwetter,Politics
mikie sherrill reacts election victory,Politics
trump blame shutdown gop election loss,Politics
democrat didnt rebound dominated,Politics
affordability affordability affordability democrat new winning formula,Politics
trump reversal call house gop vote release epstein file,Politics
msnbc officially rebrands m know,Politics
faa ending flight reduction major u airport,Politics
trump administration withdraw national guard troop chicago portland report,Politics
suozzi bacon pitch aca subsidy extension save people thousand thousand dollar,Politics
louisiana republican say he concerned possible hepatitis b vaccine schedule change,Politics
britt say senate take look k tariff check,Politics
sander seek elevate progressive senate candidate amid democratic divide,Politics
bessent k tariff check would go working family,Politics
murphy say democrat made mistake reopening government without aca subsidy,Politics
u military kill narcoterrorists eastern pacific us gerald ford arrives caribbean,Politics
trump administration willing look option health care oz,Politics
senator surveillance payday expose flawed privacy law,Politics
new york jet cornerback kris boyd shot manhattan source,Politics
massie predicts deluge house republican vote release epstein file,Politics
johnson epstein push democrat entire game plan,Politics
oz trump administration weighing aca subsidy extension,Politics
government reopened congress must protect hiv funding,Politics
white house grapple sell trump agenda,Politics
congress full millionaire raising money becomes job,Politics
greene denies trump told run georgia governor,Politics
khanna say trump losing maga base epstein file,Politics
greene trump remark put life danger,Politics
ban gun marijuana alcohol abuse make sense,Politics
kaine defends schumer minority leader tough,Politics
live update trump greene rift deepens ahead house epstein vote,Politics
u ramp military presence near venezuela,Politics
change coming tax filing season know,Politics
pressure isaacman could get u back moon china,Politics
ken burn new series offer chance reflect contribution john adam,Politics
trump issue new pardon jan rioter,Politics
sixfigure earner feel theyre survival mode poll,Politics
sorry republican democratic socialist longer careerender u politics,Politics
tariff could cause price italianmade pasta surge,Politics
government shutdown hurt military personnel,Politics
canada loses measles elimination status u close behind,Politics
republican clash surprise phone record provision could enrich senator,Politics
majority american disapprove ice operates survey,Politics
michelle obama say u ready woman oval office,Politics
exclusive becerra say investigator didnt inform full case former staff,Politics
border patrol operation start charlotte,Politics
maher troll trump epstein file dump feel like ive seen movie four time,Politics
dulles people mover slow uncomfortable occasionally dangerous washington post,Politics
trump muddle populist message worrying supporter,Politics
fetterman share photo face injury fall hospitalization,Politics
trumpgreene feud intensifies new barb,Politics
sunday show preview epstein file back spotlight trump dismay shutdown impact remain,Politics
labubu movie work sony report,Politics
tariff cause shortage holiday decor,Politics
federal public defender gone without pay since july,Politics
trump admin eye moving convicted election clerk tina peter federal custody,Politics
republican rescue party something good american,Politics
issue center trumpgreene spat,Politics
empire state delusion rent control illusion affordability,Politics
man tied indicted milwaukee judge hannah dugans case deported dhs say,Politics
jen psaki right enough talking point,Politics
whats next house return shutdown fight,Politics
social security cola benefit increase,Politics
senate democrat trump daily panic mode epstein file,Politics
suspect accused breaching alina habbas office custody got,Politics
trump prevent genocide sudan watch,Politics
trump say rino greene betrayed entire republican party,Politics
reverse dumbing american higher ed,Politics
abundance agenda sound like political winner isnt,Politics
greene call new way forward trump pull support,Politics
kinzinger push back greene recent gop criticism really con artist,Politics
new jersey worker classification crackdown could broad impact,Politics
proposal could mean additional social security recipient,Politics
judge bar trump slashing funding university california,Politics
doj investigation berkeley turning point protest sends warning college,Politics
democrat aim shutdown fury senate primary,Politics
reid hoffman responds trump epstein investigation order obvious ploy,Politics
trump mri idea analyzed,Politics
disney youtubetv reach deal restore abc espn streamer,Politics
trump say sort made mind venezuela,Politics
trump say sue bbc b b,Politics
trump pull endorsement greene amid growing rift,Politics
faa eas flight cut percent,Politics
percent young woman want leave u permanently poll,Politics
excbp officer sentenced year prison drug trafficking scheme,Politics
trump cut tariff score product bid lower price,Politics
hegseths southern spear operation pummel narcoterrorists know,Politics
mike waltz paint trump board peace path secure gaza without hamas,Politics
archive release first batch amelia earhart record pledged trump,Politics
hemp industry battle save thc product ban thing know,Politics
bipartisan group senator call release funding lowincome heating immediately,Politics
usda head say everyone snap reapply,Politics
ghislaine maxwell attorney say staffer prison fired email leaked,Politics
hemp thc product could banned congress gummies vapes drink cream,Politics
tennessee democrat suggests tearing trump ballroom gop loses,Politics
ufc fighter reject white house cage match hunger game type fing,Politics
former uva president accuses doj demanding ouster threat funding cut,Politics
coast guard spot russian ship mile hawaii,Politics
bondi put weight sdny behind epstein investigation democrat,Politics
half american oppose caribbean strike poll,Politics
indiana senate gop doesnt vote redistricting dealing blow trump,Politics
trump border czar say catholic church wrong mass deportation,Politics
scarborough trump coalition end exit scene like reagan obama,Politics
national institute health staffer put nondisciplinary leave criticizing nih politicization,Politics
greene trump making huge miscalculation epstein,Politics
trump call house republican vote release epstein file nothing hide,Politics
trump reveals maduro would like talk military option remain table venezuela,Politics
marco rubio say nicols maduros cartel de los sol designated terrorist organization,Politics
speaker lobby happy new year shutdown showdown draw close,Politics
u force kill narcoterrorists eastern pacific lethal strike operation targeting drug network,Politics
zelenskyy move clean ukraine energy sector corruption scandal rock leadership,Politics
sky stake inside uschina race air dominance,Politics
michelle obama say america ready woman president saw past election,Politics
laura loomer tease georgia move president trump say want marjorie taylor greene primaried,Politics
democratic rep brad sherman denies viewing pornography flight viral photo surface online,Politics
border czar tom homan slam catholic church say secure border save life,Politics
sen fetterman share graphic photo heart rhythm scare say doctor put back together,Politics
indiana senate republican reject trumpbacked redistricting push decline meet december,Politics
trump issue fresh pardon jan defendant including woman accused threatening fbi social medium,Politics
trump end shutdown face backlash make surprise epstein move amid chaotic week,Politics
trump give exally greene new nickname dropped endorsement say betrayed entire republican party,Politics
leading senate democrat tell fox news time new leadership schumer face growing pressure,Politics
meet socialist mamdanistyle mayor elected run west coast th largest city,Politics
dems say base rightfully angry leader caving gop shutdown fight porch puppy,Politics
setting stage election signal next year midterm showdown,Politics
fbi arrest suspect attack u attorney alina habbas office,Politics
socialist wave go coasttocoast historic win shake mayoral election,Politics
epa chief wrap national tour critic slam deregulation agenda,Politics
destiny dynasty inside new class political nepo baby vying power,Politics
trump administration stay silent massive ukraine corruption scandal rock zelenskyys inner circle,Politics
kyrsten sinemas decision make democrat senate map tighter,Politics
meet woman steering bidens bipartisan winning streak capitol hill,Politics
cnn political briefing,Politics
axe file david axelrod,Politics
margin error,Politics
notable legal cloud continue hang donald trump,Politics
fine print respect marriage act,Politics
everything need know bidens student loan forgiveness program,Politics
politics day,Politics
intro apr insane,Politics
official avoid credit card interest,Politics
expert best cash back card,Politics
turn rising home equity cash use,Politics
dream big home equity loan,Politics
want cash home best option,Politics
use right card holiday gift save hundred interest,Politics
card charging interest,Politics
get cash back bonus holiday gift buying,Politics
trump administration escalates pressure venezuela,Politics
trump defends tucker carlson nick fuentes interview,Politics
trump say house republican vote release epstein file,Politics
u airport restriction end monday,Politics
latest u strike boat pacific kill southern command say,Politics
marjorie taylor greene back trump stand firm epstein file,Politics
pentagon withdraw national guard troop chicago portland,Politics
epstein email reveal lost new york,Politics
homeland security mission falter amid focus deportation,Politics
make sense law enforcement street,Politics
trump pardon two crime related jan,Politics
gallego pitch demoralized democrat midterm message,Politics
interview white nationalist tucker carlson continues fracture right,Politics
map show latino shifted right snapped back left,Politics
fired scholar big grant favored project inside trump neh,Politics
donald trump end support marjorie taylor greene call wacky,Politics
two officer injured crash protecting jd vances motorcade,Politics
trump say longer support marjorie taylor greene,Politics
danish startup flatpay join club european fintech unicorn track,Technology
beloved sf cat death fuel waymo criticism,Technology
buy pay later expanding fast worry everyone,Technology
nearing end apple tim cook era,Technology
amazon satellite network get rebrand drop affordability pitch,Technology
techcrunch mobility robotaxi expansion really matter,Technology
much ai data center boom powered renewable energy,Technology
jpmorgan doesnt want pay frank founder charlie javices legal bill,Technology
jury say apple owes masimo patent infringement,Technology
disney youtube tv reach deal end blackout,Technology
leaked document shed light much openai pay microsoft,Technology
databricks cofounder argues u must go open source beat china ai,Technology
comprehensive list tech layoff,Technology
chatgpt everything need know aipowered chatbot,Technology
tesla release detailed safety report waymo coceo called data,Technology
oura ring ceramic review colorful glowup,Technology
openai say fixed chatgpts em dash problem,Technology
five people plead guilty helping north korean infiltrate u company remote worker,Technology
boeing carbon emission problem startup charm industrial cleaning,Technology
german court rule google must pay violating antitrust rule price comparison sector,Technology
best organic mattress birch avocado naturepedic,Technology
best action camera tested reviewed,Technology
marshall heston review premium style restrained sound,Technology
best subscription box kid stem book clothes snack,Technology
gene harnessed physic grow living thing,Technology
nordvpn review living name,Technology
gift gym bros best workout gear gym essential,Technology
use google gemini chatgpt organize life scheduled action,Technology
ditched alexa upgraded smart home,Technology
best tv weve reviewed sony samsung lg,Technology
best gift pc gamers headset desk monitor,Technology
best lip balm try tested tough condition,Technology
analog photography beginner guide film camera,Technology
best natural deodorant tested daily use,Technology
best movie amazon prime wireds pick november,Technology
invasive diseasecarrying mosquito spread rocky mountain,Technology
best show amazon prime wireds pick november,Technology
use new ai feature omnifocus power user todo list,Technology
major leak spill chinese hacking contractor tool target,Technology
gear news week steam make home console apple debut pouch iphone,Technology
automated holiday party idea ninja hp sprocket cricut,Technology
u finally get k ev,Technology
doordash promo code november,Technology
best tried tested gift bird lover,Technology
doj issued seizure warrant starlink satellite internet system used scam compound,Technology
black friday expert tip finding best deal,Technology
chinese beverage chain spread across u challenging starbucks dominance,Technology
best early black friday deal wiredtested gear,Technology
favorite webcam marked,Technology
inside multimilliondollar plan make mobile voting happen,Technology
data center resistance arrived,Technology
weightloss drug zepbound tested treatment long covid,Technology
best magsafe phone grip tested reviewed,Technology
maga wanted epstein file theyre ignoring,Technology
best android phone tested reviewed,Technology
best camera accessory phone tripod mics light,Technology
amazon fire tablet tested dont,Technology
whats best hair straightener depends,Technology
razer cobra hyperspeed basic gaming mouse need,Technology
woolroom luxury wooly mattress review supple stinky,Technology
cook turkey outside thanksgiving,Technology
hydroelectric dam really make day longer,Technology
best holiday photo card mixbook vistaprint canva,Technology
window recall worksand whether switch,Technology
best deal real holiday sale,Technology
wont able offload holiday shopping ai agent anytime soon,Technology
airport airline crawling shutdown,Technology
blue apron coupon promo code november,Technology
hungryroot coupon code november,Technology
hellofresh coupon code free meal november,Technology
pay ai wrong,Technology
softbank sell billion stake nvidia pay openai deal,Technology
debt funding ratcheting risk ai boom,Technology
ai journalist newsroom tool,Technology
fraudsters use cryptocurrency atm target victim,Technology
seattle stranger became progressive kingmaker,Technology
data center space ai policy right gemini history mystery,Technology
almost everything nasa escapade mission mar unusual,Technology
apps make love art gallery,Technology
northern light beautiful satellite theyre risky,Technology
russian humanoid robot fall face hyped debut,Technology
solvay belgium creates rare earth deal u,Technology
cybathlon may best braincomputer interface win,Technology
missing un climate meeting american executive,Technology
blue origin scrub launch nasa escapade mission mar,Technology
china resume chip export easing fear global crunch,Technology
evolution rationality chimp process conflicting evidence,Technology
wyoming dinosaur mummy give u new view duckbilled specie,Technology
u may owe trillion refund scotus cancel trump tariff,Technology
twin probe launched toward mar easter egg board,Technology
shutdown end dubious cdc panel get back dismantling vaccine schedule,Technology
two nissan leaf help make regional airport resilient,Technology
fcc bos brendan carr say wont end news distortion probe,Technology
whats like compete longest u offroad rally gps,Technology
three astronaut stuck china space station without safe ride home,Technology
forget agisam altman celebrates chatgpt finally following em dash formatting rule,Technology
world oldest rna extracted ice age woolly mammoth,Technology
dog came wide range size shape long modern breed,Technology
scientist pleaded guilty smuggling fusarium graminearum u,Technology
year later arkanes dishonored still modern stealth classic,Technology
blue origin new glenn rocket came back home taking aim mar,Technology
researcher question anthropic claim aiassisted attack autonomous,Technology
rocket report blue origin stunning success vive le baguette one,Technology
